tel,name,address
 15850015206 ,苏州融道非融资性担保有限公司,"狮山路28号高新广场501室,电话："
 18605125717 ,中融投资,"苏州高新区高新广场,电话："
 13962118551 ,苏州鼎峰投资,"苏州吴中大厦709室,电话："
 18362600466 ,苏州蓝海财行非融资性担保有限公司,电话：
 13063708355 ,苏州傲信投资管理有限公司,"苏州长江路与何山路交汇处,电话："
 18550406063 ,缘天贷款,"苏州工业园区南施街领汇广场18楼,电话："
 15298649999 ,苏州威必思企业管理有限公司,"苏州市吴中区东方大道好得家装饰城,电话："
 15995767771 ,扬诚投资,"苏州,电话："
 13962118551 ,苏州锋鑫投资担保,"苏州吴中区吴中大厦,电话："
 0512-69153281 ,江苏诚建投资担保,"苏州姑苏区苏州南门汽车站对面汇邻广场商务中心11楼1123,电话："
 13913578123 ,鑫博汇投资咨询,"昆山,电话："
 18267690072 ,鼎好投资,"台州市市区中心服务全台州,电话："
 18115684686 ,圣博投资,"苏州高新区润捷广场17楼1701,电话："
 18115502444 ,苏州凯翔投资,"苏州新区大润发附近,电话："
 13921972341 ,智富汇普投资有限公司,"人民东路9号国泰东方广场4楼402,电话："
 15250040343 ,苏州融信汇金,"苏州,电话："
 15850138284 ,中安信业投资贷款,"苏州高新区金河国际大厦805,电话："
 13218183757 ,融江担保,"苏州,电话："
 15950189162 ,昆山市荣诚投资咨询管理有限公司,"黄河路合兴路555号,电话："
 13913567401 ,帛易投资管理,"昆山常熟太仓张家港均匀分部,电话："
 15152426323 ,苏州快融投资管理有限公司,"苏州,电话："
 13771703884 ,江苏融行智非融资性担保有限公司,"苏州,电话："
 13915523088 ,苏州华兰贝格投资管理,"园区苏华路8号中银惠龙大厦27F,电话："
 15365355684 ,裕航商务服务,"吴江市盛泽镇郎中社区服务中心对面,电话："
 15195600844 ,宜信贷款,"苏州狮山路百合花公寓7幢602室,电话："
 13806266417 ,昆山金汇通投资担保管理有限公司,"昆山开发区珠江北路67号,电话："
 13771862714 ,鑫利园房产投资,"昆山苏州吴江连锁放款,电话："
 18036117288 ,信和汇金信息咨询（北京）有限公司昆山分公司,"江苏省苏州市昆山市前进中路216号,电话："
 1586-2373723 ,汇丰投资管理有限公司,"苏州吴中区新苏国际,电话："
 17768414444 ,金新诚财富管理（苏州）有限公司,"苏州,电话："
 151-5014-7722 ,苏州金达投资,"苏州东环，服务全苏州,电话："
 15306135000 ,维信融资租赁（苏州）有限公司,"苏州市工业园区湖东晋合广场2座1006室,电话："
 13862639826 ,昆山千顺投资管理有限公司,"昆山马鞍山西路1875号,电话："
 13328059113 ,南京市鼓楼区定乾投资信息咨询中心,"苏州市绿宝广场436号,电话："
 18013090857 ,苏州微汇金融信息服务有限公司,"苏州工业园区华池街晋合广场,电话："
 15306201212 ,苏州阳企巴巴投资管理有限公司,"苏州市吴中区吴中东路175号天域大厦,电话："
 13913561393 ,昆山银启元网络信息咨询有限公司,"苏州昆山市玉山镇伟业路8号现代广场B座2411室,电话："
 18013591577 ,亿邦贷,"苏州,电话："
 13814554880 ,苏州双威投资咨询有限公司,"昆山市柏庐中路88号二楼双威投资,电话："
 18913243644 ,苏州团贷普惠非融资性担保有限公司,"昆山,电话："
 18796892398 ,太仓昆山阳光易贷有限公司,"太仓长春北路35号,电话："
 17714092009 ,双利投资咨询,"苏州,电话："
 18251184448 ,苏州北丰投资,"苏州工业园区镇政府斜对面,电话："
 18762897604 ,禄海宁投资,"苏州,电话："
 17306199996 ,苏州耀淏投资管理咨询有限公司,"苏州,电话："
 15995601435 ,弘鑫投资担保有限公司,"昆山百盛广场9楼,电话："
 18672898259 ,海塔投资咨询,"苏州,电话："
 17315264242 ,安徽天宇资产管理有限公司,"苏州,电话："
 15262377945 ,苏州牛信投资管理有限公司,"苏州东盛步行街中心广场1号楼529,电话："
 15214304093 ,上海甘南实业,"上海市浦东新区富特北路402号,电话："
 15370075859 ,大宏投资,"江苏省范围均可办理,电话："
 15151610531 ,江苏裕财投资咨询有限公司,"伟业路18号现代广场A座1408,电话："
 15121026202 ,苏州万通投资咨询,"苏州市高新区狮山,电话："
 18912676714 ,富诺投资,"苏州,电话："
 18260434333 ,苏州亮峰投资,"苏州园区,电话："
 18251151211 ,万邦投资,"苏州,电话："
 13913186062 ,苏州双华投资,"苏州吴中区东吴北路299吴中大厦,电话："
 15150115058 ,金地汇投资咨询,"服务苏州各个区域,电话："
 18112577699 ,苏州赢正投资管理有限公司,"苏州常熟张家港昆山,电话："
 15851483275 ,苏州后河非融资性担保有限公司,"苏州市高新区狮山路高新广场,电话："
 13390887887 ,苏州北城世居不动产投资咨询有限公司,"江苏苏州平江观前干将东路666号和基广场506室,电话："
 13405058420 ,云海,"苏州工业园区联丰广场附近,电话："
 13816947713 ,中信建投期货有限公司上海世纪大道营业部,电话：
 18261002232 ,昆山奥鑫科投资咨询有限公司,"昆山,电话："
 18724032235 ,跳跳熊,"阊胥路454号金盈大厦705室,电话："
 15050190065 ,苏州东吴投资,"苏州吴中区吴中人民医院对面新苏国际广场,电话："
 15209827787 ,本博投资,"全国范围均可办理,电话："
 15950175209 ,紫金普惠金融有限公司,"昆山市伟业路现代广场B座2108室,电话："
 17701552963 ,苏州市英平投资咨询服务有限公司,"开平路789号金城大厦10楼,电话："
 13501976006 ,海鸿浩融资租赁,"云桥路118号同城浦江大厦1号楼,电话："
 15006132888 ,盛世宏业投资,"苏州吴中科技金融服务中心东创科技园B2幢507,电话："
 18625037985 ,效力投资,"昆山市玉山镇老城区,电话："
 13020199951 ,旭赫投资咨询,"上海普陀新村路423弄,电话："
 15895665826 ,杭州丰阁投资管理有限公司,"昆山市玉山镇,电话："
 13812742299 ,瑞融汽车租赁,"武进区湖塘镇华都馨苑,电话："
 18136968163 ,德志投资,"苏州,电话："
 13179610960 ,苏州尚银非融资性担保有限公司,"昆山昆城国贸一栋,电话："
 17721329567 ,苏州快马投资,"苏州全苏州各区服务,电话："
 15190061190 ,杭州众利合融投资咨询有限公司,"苏州市高新区马云路252号,电话："
 18550107377 ,苏州信泰富,"苏州平江区人民路3188号万达广场B座18楼,电话："
 18550461201 ,上海证大投资咨询有限公司苏州通园路分公司,"苏州,电话："
 15151697885 ,邦茂投资咨询,"苏州,电话："
 13182614510 ,卓越投资,"苏州,电话："
 15995791899 ,龙瀚投资管理,"苏州,电话："
 15371872003 ,苏州飞特投资管理有限公司,"苏州南门汽车站对面、汇邻广场商务中心508室,电话："
 18100670123 ,苏州九凡投资管理有限公司,"苏州,电话："
 15895639562 ,大展投资管理有限公司,"昆山,电话："
 18112609141 ,苏州鼎泰投资,"东吴北路299号吴中大厦910室,电话："
 15150459280 ,苏州全广投资管理有限公司,"苏州园区圆融时代广场,电话："
 18550087122 ,鼎力石磊投资,"苏州,电话："
 13145075888 ,苏州邦诚投资,"工业园区扬东路277号晶汇大厦1508室,电话："
 18360955678 ,广聚投资担保有限公司,"江苏省苏州市昆山市前进东路291号,电话："
 0512-68832799 ,苏州久丰投资管理有限公司,"苏州市人民路3188号万达广场C座1210A,电话："
 13816219911 ,兴代投资管理有限公司,"上海普陀华池路58弄,电话："
 18362787971 ,寅尚投资,"苏州,电话："
 13282035681 ,弘马资产管理,"苏州,电话："
 13382107285 ,聚源投资,"苏州东吴北路181号,电话："
 13506137572 ,宜信普惠信息咨询(北京)有限公司苏州分公司,"苏州高新区高新广场,电话："
 18662193668 ,苏州中茵投资担保有限公司,"苏州,电话："
 18626215888 ,江苏金雅当投资有限公司,"苏州宝带西路世茂生活广场,电话："
 13771950551 ,苏州点赞汽车贸易有限公司,"苏州木渎长三角二手市场,电话："
 13915413560 ,润海投资苏州分部,"苏州,电话："
 15295673609 ,苏州盈凯福投资咨询有限公司,"苏州市高新区竹园路工业园区财富广场4幢713室,电话："
 15850284915 ,南京好运来投资管理有限公司,"苏州,电话："
 18562576699 ,青岛广源贷款,"青岛市市北区山东路42号,电话："
 15501581446 ,苏州金钱豹建筑装饰工程有限公司,电话：
 13812965642 ,服装批发,电话：
 15905161114 ,中煜国资证券投资咨询有限公司,"南京市,电话："
 18012980878 ,南京胜沃投资贷款管理有限公司,"南京,电话："
 13093828060 ,武汉市洪山区沸腾牛火锅店,电话：
 13390833726 ,友众信业金融信息服务（上海）有限公司苏州锦翎分公司,电话：
 13125177777 ,苏州旭驰投资咨询有限公司,"昆山市现代广场B座23楼2305,电话："
 15151415565 ,苏州金地汇商贸,"苏州相城元和凯翔广场,电话："
 18501517669 ,万城投资有限公司,"苏州吴中宝带东路中润中心,电话："
 13690027933 ,汇生鲜水产,电话：
 13771862714 ,金利元投资,"昆山苏州吴江连锁放款,电话："
 18662255545 ,苏州天邦投资有限公司,"昆山市长江路177号新都银座,电话："
 15189801825 ,南京市浦口区乐味多快餐店,"南京市玄武区德基广场16楼,电话："
 15221166921 ,鸿浦信息,电话：
 18112728555 ,苏州市吴中区龙翔汽车驾驶员培训有限公司,"苏州8家分校直招,电话："
 15722925897 ,南京市栖霞区徐家万装饰材料经营部,电话：
 18621509091 ,苏州胡子投资管理有限公司,"苏州市相城区聚元街551号,电话："
 18015422851 ,安置居房产,电话：
 13771862714 ,昆山鑫利园房产投资咨询有限公司,电话：
 15718862029 ,广州博斯绅威商贸有限公司,"广州56895689,电话："
 18918088512 ,上海常年投资咨询有限公司,"浦东新区张杨路2859号近德平路,电话："
 13077392502 ,北京信诚时代投资管理有限公司,电话：
 15062573621 ,制造销售,"東张威马逊足浴會所,电话："
 15161480726 ,奥吉兰莉针织品店,电话：
 13901241427 ,隆豪财富（北京）投资咨询有限公司,"北京市西城区广安门,电话："
 13002529502 ,雄瀚投资,电话：
 13918898489 ,上海戴思投资咨询有限公司,"金融大大厦9层909,电话："
 15692171895 ,中信建投期货,电话：
 13816947713 ,中信建投期货,"世纪大道1589号长泰国际金融大厦8楼,电话："
 13584827292 ,苏州旭赫投资咨询,"苏州沧浪区解放西路,电话："
 13401426059 ,苏州融汇通投资有限公司,"苏州金阊干将西路515号,电话："
 15962358284 ,张家港亿鑫金融信息咨询有限公司,"张家港市港城大道156号市公安局向南100米,电话："
 15158049778 ,杭州泰来投资有限公司,"杭州西湖区庆春路235号西湖国贸中心3楼320室,电话："
 18625056521 ,苏州鼎宏投资管理有限公司,"昆山,电话："
 15896459593 ,海通投资管理有限公司,"南京市鼓楼区华侨路37号春风大厦,电话："
 18013835689 ,南京金客来投资管理有限公司,"南京市,电话："
 18936139597 ,盛泽扬天电脑科技,"吴江市盛泽镇西二环往西200米财富中心西门旁盛泽扬天电脑店,电话："
 13824303687 ,芜湖市近山环保水泥有限公司,电话：
 13128924342 ,永嘉县贝贝园游乐设备有限公司,电话：
 18013307969 ,良宇置业,电话：
 13912949290 ,南京守道资产管理有限公司,"南京市,电话："
 18569032435 ,开心贷金融信息服务有限公司,"湖南省长沙市雨花区黑梨路,电话："
 17701745678 ,定乾投资,"苏州,电话："
 17081600709 ,深圳市至爱电子商务有限公司,"苏州吴中区天城大厦1107,电话："
 18688301611 ,武汉册利锦电子有限公司,"北京通州大厦36号,电话："
 13611961098 ,四联投资,电话：
 18018123637 ,苏州州瓦力商务信息咨询有限公司,"吴中区金枫路216号东创科技园B3栋802,电话："
 15151773967 ,友信,"苏州高新区狮山路88号金河国际中心615室,电话："
 18260228098 ,投资管理,"苏州昆山前进中路国际大厦11楼,电话："
 13914052405 ,苏州宝典财务服务有限公司,"苏州工业园区唯正路11号1幢935,电话："
 13928485213 ,雅美汇电子商务,电话：
 18254223333 ,青岛宝泰隆投资咨询有限公司,"青岛市市北区山东路42号,电话："
 18551845551 ,南京新天地小额贷款公司,"南京新街口友谊大厦,电话："
 13295148317 ,锦研科技,电话：
 13986866263 ,昆山市玉山镇合韵唐足浴店,"江苏省苏州市昆山市开发区樾城路188号开发区,电话："
