tel,name,address
 15151610531 ,江苏裕财投资咨询有限公司,"伟业路18号现代广场A座1408,电话："
 18796892398 ,太仓昆山阳光易贷有限公司,"太仓长春北路35号,电话："
 13771703884 ,江苏融行智非融资性担保有限公司,"苏州,电话："
 17714092009 ,双利投资咨询,"苏州,电话："
 18251184448 ,苏州北丰投资,"苏州工业园区镇政府斜对面,电话："
 18762897604 ,禄海宁投资,"苏州,电话："
 17306199996 ,苏州耀淏投资管理咨询有限公司,"苏州,电话："
 15995601435 ,弘鑫投资担保有限公司,"昆山百盛广场9楼,电话："
 17315264242 ,安徽天宇资产管理有限公司,"苏州,电话："
 15050190065 ,苏州东吴投资,"苏州吴中区吴中人民医院对面新苏国际广场,电话："
 18550085590 ,锐拓互联网金融投资有限公司,"苏州,电话："
 18136968163 ,德志投资,"苏州,电话："
 18662193668 ,苏州中茵投资担保有限公司,"苏州,电话："
 18362600466 ,苏州蓝海财行非融资性担保有限公司,电话：
 18112609141 ,苏州鼎泰投资,"东吴北路299号吴中大厦910室,电话："
 13913561393 ,昆山银启元网络信息咨询有限公司,"苏州昆山市玉山镇伟业路8号现代广场B座2411室,电话："
 18013591577 ,亿邦贷,"苏州,电话："
 13814554880 ,苏州双威投资咨询有限公司,"昆山市柏庐中路88号二楼双威投资,电话："
 18913243644 ,苏州团贷普惠非融资性担保有限公司,"昆山,电话："
 15150459280 ,苏州全广投资管理有限公司,"苏州园区圆融时代广场,电话："
 18912676714 ,富诺投资,"苏州,电话："
 13382107285 ,聚源投资,"苏州东吴北路181号,电话："
 13962118551 ,苏州鼎峰投资,"苏州吴中大厦709室,电话："
 1586-2373723 ,汇丰投资管理有限公司,"苏州吴中区新苏国际,电话："
 18362787971 ,寅尚投资,"苏州,电话："
 17721329567 ,苏州快马投资,"苏州全苏州各区服务,电话："
 18260434333 ,苏州亮峰投资,"苏州园区,电话："
 13771854799 ,度尔贷款,"苏州市高新区汇豪国际,电话："
 18550461201 ,上海证大投资咨询有限公司苏州通园路分公司,"苏州,电话："
 13656267557 ,昆山尚扬畅汇投资管理有限公司,"昆山,电话："
 18360955678 ,广聚投资担保有限公司,"江苏省苏州市昆山市前进东路291号,电话："
 151-5014-7722 ,苏州金达投资,"苏州东环，服务全苏州,电话："
 13282035681 ,弘马资产管理,"苏州,电话："
 18251151211 ,万邦投资,"苏州,电话："
 15221166921 ,鸿浦信息,电话：
 15121026202 ,苏州万通投资咨询,"苏州市高新区狮山,电话："
 18501597306 ,友众信业金融,"加城大厦8楼4D,电话："
 15850138284 ,中安信业投资贷款,"苏州高新区金河国际大厦805,电话："
 15190061190 ,杭州众利合融投资咨询有限公司,"苏州市高新区马云路252号,电话："
 13390887887 ,苏州北城世居不动产投资咨询有限公司,"江苏苏州平江观前干将东路666号和基广场506室,电话："
 18762897471 ,邦尼投资,"苏州,电话："
 13182614510 ,卓越投资,"苏州,电话："
 13218183757 ,融江担保,"苏州,电话："
 13915523088 ,苏州华兰贝格投资管理,"园区苏华路8号中银惠龙大厦27F,电话："
 15206206008 ,苏州维顺投资咨询有限公司,"苏州,电话："
 15209827787 ,浩轩投资,"江苏省皆有分公司,电话："
 18550102511 ,天玑财讯投资,"高新区华福大厦10楼,电话："
 18362966645 ,华文金融,"江苏省地区均有分公司,电话："
